{
  "schemaVersion": "1.0.0",
  "generatedAt": "2026-10-30T10:44:17Z",
  "base": {
    "sha": ""
  },
  "head": {
    "sha": "d84152f20ecc43719689fd91cd0f0864fa09c59f"
  },
  "summary": {
    "newRoles": 0,
    "removedRoles": 0,
    "changedRoles": 0,
    "readOnlyChanges": 0,
    "needsReview": false
  },
  "newRoles": [],
  "removedRoles": [],
  "changedRoles": []
}
